{
  "$schema": "https://json-schema.org/draft/2020-12/schema",
  "$id": "https://solidprivacy.nl/schemas/legal_context_request.schema.json",
  "title": "SolidPrivacy Legal Context Request",
  "type": "object",
  "required": ["id", "purpose", "jurisdiction", "as_of", "max_verification_age_days", "required_rule_ids", "optional_source_ids", "include_nonfinal_context"],
  "properties": {
    "id": {"type": "string", "minLength": 1},
    "purpose": {"const": "dpia_analysis"},
    "jurisdiction": {"type": "array", "items": {"type": "string"}, "minItems": 1, "uniqueItems": true},
    "as_of": {"type": "string", "format": "date"},
    "max_verification_age_days": {"type": "integer", "minimum": 0},
    "required_rule_ids": {"type": "array", "items": {"type": "string"}, "minItems": 1, "uniqueItems": true},
    "optional_source_ids": {"type": "array", "items": {"type": "string"}, "uniqueItems": true},
    "include_nonfinal_context": {"type": "boolean"}
  },
  "additionalProperties": false
}
