{"id":"LC-REQ-DPIA-001","purpose":"dpia_analysis","jurisdiction":["EU/EEA","NL"],"as_of":"2026-08-10","max_verification_age_days":30,"required_rule_ids":["gdpr-art35-1-high-risk","gdpr-art35-2-dpo-advice","gdpr-art35-7-minimum-content","gdpr-art36-1-prior-consultation","edpb-wp248-two-criteria","nl-ap-list-mandatory-and-nonexhaustive"],"optional_source_ids":["nl-government-par-dpia-model","edpb-dpia-template-2026"],"include_nonfinal_context":true}